Category,Title,Date,URL,Content
Mystery & Thriller,Bookreporter.com |,2025-03-09,https://www.bookreporter.com,"The Book Report Network Sign up for our newsletters! In Clare Leslie Hall's much-talked-about US debut, a love triangle unearths dangerous, deadly secrets from the past. A detective and a TV show producer race to prevent another young woman from disappearing before the next blood moon. The deadline for your entries is Friday, March 21st at noon ET. This riveting and utterly original novel is about one woman’s fight for freedom, set in a near future where even dreams are under surveillance. A woman tries to uncover a mystery surrounding a local librarian and the Boxcar Library, which brought books to isolated rural towns in Montana. Our next contest will be up on Tuesday, March 11th at noon ET. The prize book will be THE WOMEN ON PLATFORM TWO by Laura Anthony. Which of the following fiction titles releasing in March do you plan to read? Please check all that apply. Take our poll »|Past poll results » Tell us about the books you’ve finished reading with your comments and a rating of 1 to 5 stars. During the contest period from February 28th to March 14th at noon ET, three lucky readers each will be randomly chosen to win a copy ofBLOOD MOONby Sandra Brown andTHE JACKAL'S MISTRESSby Chris Bohjalian. Enter contest here »|Past Entries » Our major goal for 2025 is to redesign Bookreporter and the rest of the sites in The Book Report Network. How can you help? We have launched aGoFundMecampaign and are asking for donations.Anylevel of donation that you would be comfortable with is sincerely appreciated. If you would prefer donating via check, please send to:The Book Report, Inc.16 Mt. Bethel Road, Suite 365Warren, NJ 07059Click here to read more about our plans and to donate. Curious about what books will be released in the months ahead so you can pre-order or reserve them? Then click on the months below. Bookreporter.com Bets On The following are lists of new paperback releases that we think will be of interest to you. March's Books on Screen roundup includes the series premieres of ""Just One Look"" and ""Caught"" on Netflix (both are adaptations of books by Harlan Coben), ""Long Bright River"" on Peacock, and ""The Last Anniversary"" on Sundance Now and AMC+; the season premieres of Prime Video's ""Bosch: Legacy"" and ""The Wheel of Time,"" along with ""Dark Winds"" on AMC and ""Wolf Hall: The Mirror and the Light"" on PBS ""Masterpiece""; the season finales of Prime Video's ""Reacher,"" Hallmark Channel's ""When Calls the Heart,"" and NBC's ""The Irrational""; the filmsSnow White,In the Lost Lands,The ActorandThe Friend; and the DVD/Blu-ray releases ofThe Room Next DoorandKraven the Hunter. Special Contest: Enter to Win One of 25 Advance Copies of MAYA BLUE: A Memoir of Survival, by Brenda Coffee, and Share Your Comments on It MAYA BLUEbyBrenda Coffeeisa searingly honest and unforgettable memoir that challenges women to rethink everything they know about survival, resilience and finding their voice. We have 25 advance copies to give away to those who would like to read the book, which releases on May 20th, and share their comments on it.All winners must be prepared to provide their feedbackby Monday, May 12th. The deadline for your entries is Friday, March 21st at noon ET.»Click hereto enter the contest. Our Favorite Monthly Lists & Picks for March Each month, we sharetop book picksfrom Indie Next and LibraryReads. We also feature a number of other prominent selections, including the Barnes & Noble Book Club, the ""Good Morning America"" Book Club, Oprah’s Book Club, the PBS Books Readers Club, the ""Read with Jenna"" Book Club, Reese's Book Club, and the Target Book Club. COUNT MY LIESby debut novelistSophie Stavais this month's""Good Morning America"" Book Club pick. This read-in-one-night thriller is narrated by a compulsive liar whose little white lies allow her to enter into the life and comfort of a wealthy married couple who are harboring much darker secrets themselves.»Click herefor March's Favorite Monthly Lists & Picks. Bookreporter.com's Word of Mouth Contest: Tell Us What You've Read --- and You Can Win Two Books!Let us know by Friday, March 14th at noon ET what books you’ve read, and you’ll have a chance to winBLOOD MOONby Sandra Brown andTHE JACKAL'S MISTRESSby Chris Bohjalian in ourWord of Mouth contest. InBLOOD MOON, an embittered detective and an ambitious TV show producer are in a race against the clock to prevent another young woman from disappearing before the next blood moon. Inspired by a real-life friendship across enemy lines,THE JACKAL'S MISTRESSis a Civil War love story in which the wife of a missing Confederate soldier discovers a wounded Yankee officer and must decide what she’s willing to risk for the life of a stranger.»Click hereto enter the contest. Bookreporter.com's 14th Annual Spring Reading Contests and FeatureSpring is in the air (or will be very soon)! We’ve already caught the fever --- and it’s being fueled by some wonderful new and upcoming releases. Our 14th annualSpring Reading Contests and Featurespotlights many of these picks, which we know people will be talking about over the next few months. We are hosting a series of 24-hour contests for these titles on select days through April 18th. You will need to check the site to see the featured book and enter to win. We also are sending a special newsletter to announce each title, which you can sign up forhere. Our next contest will be up on Tuesday, March 11th at noon ET. The prize book will beTHE WOMEN ON PLATFORM TWObyLaura Anthony,a sweeping and timely novel inspired by a remarkable and little-known true story.In 1970s Dublin, all forms of contraception are strictly forbidden, but an intrepid group of women will risk everything to change that.»Click hereto read all the contest details and learn more about our featured titles. As part of our mission to expand The Book Report Network, we have been shootingvideo interviewswith authors and posting them on ourYouTube channel. We also have been making them available aspodcasts. Carol loves interviewing authors, so this feels like a natural. GOOD DIRTisCharmaine Wilkerson's new novel and aBets On title. Charmaine explains how the character of Ebby Freeman came to her, along with the idea of the clay jar that has been in the family for generations. She shares the research that she did about the work of slaves in the South who created pottery with clay, tracing how an item like this could have made its way from the South to Connecticut with slaves who worked on sailing vessels. And she muses that what happened to Ebby would have a major impact on the rest of her life. As she did in herNew York Timesbestseller,BLACK CAKE, Charmaine invites readers to look at traditions and ideas that they may not have heard about previously while at the same time telling the story of a family. Watch thevideoor listen to thepodcast. Carol had the pleasure of catching up withMarie Benedictabout her latest novel,THE QUEENS OF CRIME, which is aBets On selection. Marie read classic women’s mysteries at a young age, as she was introduced to them by her aunt. Her love for the genre influenced this book, as well as her earlier work,THE MYSTERY OF MRS. CHRISTIE. She discusses the case that the five female crime writers in the novel set out to unravel, explains why a case like this might have taken long to solve, and talks more about the legendary Detection Club. Marie also shares what she is working on now and notes a future collaboration, once again, withVictoria Christopher Murray. Watch thevideoor listen to thepodcast. Joseph Finder's new book,THE OLIGARCH’S DAUGHTER, is aBets On pick. In this breakneck thriller, a young hedge funder falls for an attractive woman he meets at a party who turns out to be the daughter of a Russian oligarch. Joe talks about writing the novel’s two time frames and how the awareness of what oligarchs are has become a lot more timely in the past few years. He did some wilderness training for part of the book and then jumped at the chance to learn more about superyachts that are owned by the uber-wealthy. Joe explains the process of building his characters and what drives them. He also shares what’s next for him. Watch thevideoor listen to thepodcast. »Click herefor a complete list of our ""Bookreporter Talks To"" videos and podcasts, along with upcoming interviews. After more than a year of laying low, Billie, Helen, Mary Alice and Natalie are called back into action. When they receive a summons from the head of the elite assassin organization known as the Museum, they are ready to tackle the greatest challenge of their careers. Someone on the inside has compiled a list of important kills committed by Museum agents, connected to a single, shadowy figure, an Eastern European gangster with an iron fist, some serious criminal ambition, and a tendency to kill first and ask questions later. This new nemesis is murdering agents who got in the way of their power-hungry plans, and the aging quartet of killers is next. Together the foursome embark on a wild ride across the globe on the double mission of rooting out the Museum’s mole and hunting down the gangster who seems to know their next move before they make it. Betty MacDonald was a 28-year-old reporter from Hawaii. Zuzka Lauwers grew up in a tiny Czechoslovakian village and knew five languages by the time she was 21. Jane Smith-Hutton was the wife of a naval attaché living in Tokyo. Marlene Dietrich, the German-American actress and singer, was one of the biggest stars of the 20th century. As members of the OSS during World War II, their task was to create a secret brand of propaganda produced with the sole aim to break the morale of Axis soldiers. Betty, Zuzka, Jane and Marlene forged letters and “official” military orders, wrote and produced entire newspapers, scripted radio broadcasts and songs, and even developed rumors for undercover spies and double agents to spread to the enemy. And outside of a small group of spies, no one knew they existed. Until now. Ward D is the hospital's mental health unit, and as a medical student, Amy is required to gain experience on the floor. But little do her colleagues know that it may force her to confront a past she has fought hard to forget. The night starts. The countdown begins. As the hours tick by, Amy grows increasingly convinced that something terrible is happening within the ward's tightly secured walls. When patients and staff start to vanish without a trace, it becomes clear that everyone on the unit is in grave danger. Amy never wanted to spend the night on Ward D. Now she might not make it out alive. It's July 1992, and the Troubles in Northern Ireland are still grinding on after 25 apocalyptic years. Detective Inspector Sean Duffy got his family safely over the water to Scotland, to ""Shortbread Land."" Duffy is a part-timer now, only returning to Belfast six days a month to get his pension. It's an easy gig, if he can keep his head down. But then a murder case falls into his lap while his protege is on holiday in Spain. A carjacking gone wrong and the death of a solitary, middle-aged painter. But something is not right, and as Duffy probes, he discovers that the painter was an IRA assassin. So the question becomes: Who hit the hitman, and why? This is Duffy's most violent and dangerous case yet, and the whole future of the burgeoning ""peace process"" may depend upon it. No one is more sympathetic than a mother whose child faces a life-threatening illness. But what if the mother is the cause of the illness? What if the sympathy is the point? Munchausen by proxy (MBP) has fascinated and horrified both professionals and the general public since this disturbing form of child abuse was first identified. But even as the public has been captivated by these tales of abuse and deception, there remains widespread misinformation and confusion about MBP. Are these mothers unfeeling psychopaths, or sick women who need help? And how can we protect the children whose lives are at stake? THE MOTHER NEXT DOOR offers a groundbreaking look at MBP from an unlikely duo: a Seattle novelist whose own family was torn apart by it, and the Texas detective who has worked on more medical child abuse cases than anyone in the nation. In 26 sparkling essays, illuminated through both text and image, celebrated author and artist A. Kendra Greene is trying to make sense of the things that matter most in life: love, connection, death, grief, the universe, meaning, nothingness and everythingness. Through a series of encounters with strangers, children and animals, the wild merges with the domestic; the everyday meets the sublime. Each essay returns readers to our smallest moments and our largest ones in a book that makes us realize --- through its exuberant language, playful curation and delightful associative leapfrogging --- that they are, in fact, one and the same. For the past 18 years, Ivy Gordon has been the most famous star at the Dollhouse Academy, the elite boarding school and talent incubator that every aspiring performer dreams of attending. But in secret diary entries, she begins to reveal the truth of her life at the Dollhouse: strange medical exams, mysterious supplements, and something unspeakable that has left her terrified and feeling like a prisoner. Ramona Halloway and her best friend, Grace Ludlow, grew up idolizing Ivy. Neither has made much headway in showbiz until a lucky break grants them entry to the Dollhouse. When Ramona begins to receive threatening anonymous messages, it’s easy to dismiss them as a prank from a rival. Her bigger concern is Grace’s skyrocketing success. But as the messages grow more unsettling, so does life at the Dollhouse. As the smoke from Canadian wildfires chokes Detroit, PI Amos Walker is tasked with investigating a fatal hit-and-run. The victim is Spencer Bennett, a junior law associate with the Waterford Group, and he supposedly had a file of confidential documents on him when he died. But those documents have now gone missing, and the firm is dead set on Walker finding them. As Walker digs deeper into the events leading to Bennett's death, all signs are pointing towards the crash being anything but accidental. Summer in Detroit was hot enough before the smoke descended, but as the temperature rises and more bodies crop up in connection to the missing file, Walker will have to track down those documents --- and unearth why they were worth killing over --- before it's too late. Grief-stricken over her mother’s death and bruised by her failure on her most recent case, Special Agent Emmeline Helliwell with the National Park Service returns to her Utah hometown to heal and regroup. She’s determined to turn in her badge and take over her mother’s bakery for a much quieter life…until the body of a childhood friend turns up in The Narrows of Zion National Park. The case is too personal for Emme to turn down, but the seemingly simple investigation turns treacherous as clues that connect to her previous case grow too glaring to ignore. When bodies start to pile up, Emme must track down the killer before they take more lives, venturing deep into Zion National Park to uncover the sordid secrets hiding beneath its stunning beauty. Copyright © 2025 The Book Report, Inc. All Rights Reserved."
Classic Literature,Free eBooks | Project Gutenberg,2025-03-09,https://www.gutenberg.org,"Ways to donate Choose among free epub and Kindle eBooks, download them or read them online. You will find the worldâs great literature here, with focus on older works for which U.S. copyright has expired. Thousands of volunteers digitized and diligently proofread the eBooks, for you to enjoy. Some of our latest eBooksClick Here for more latest books! No fee or registration!Everything from Project Gutenberg is gratis, libre, and completely without cost to readers. If you find Project Gutenberg useful, please consider a small donation to help Project Gutenberg digitize more books, maintain its online presence, and improve Project Gutenberg programs and offerings. Other ways to help include digitizing, proofreading and formatting, or reporting errors. New donation optionwith Give Freely.More informationâ¦. No special apps needed!Project Gutenberg eBooks require no special apps to read, just the regular Web browsers or eBook readers that are included with computers and mobile devices. There have been reports of sites that charge fees for custom apps, or for the same eBooks that are freely available from Project Gutenberg. Some of the apps might have worthwhile features, but none are required to enjoy Project Gutenberg eBooks. 50 years of eBooks 1971-2021.In 2021, Project Gutenberg celebrated thefirst eBookfor reading enjoyment and unlimited free redistribution. This eBook was created on July 4, 1971 by Project Gutenbergâs founder, Michael S. Hart.Read more about this lasting innovation. Project Gutenberg is grateful to all volunteers who helped to reach this milestone anniversary. Project Gutenberg offers a vibrant and growing collection of the worldâs great literature. Read, enjoy, and share! Audio books are a great way to enjoy and share literature. Project Gutenberg no longer adds new audio books to the collection, and suggests these audio book resources. These audio books are all freely available and in the public domain in the US. They may be easily played back on computers, tablets, mobile phones, and other devices. They may be shared non-commercially, without limitation except in countries where the printed source is still copyrighted. All of the sources listed below are digitizations of texts from Project Gutenberg. Project Gutenberg eBooks may be freely used in the United States because most are not protected by U.S. copyright law. They may not be free of copyright in other countries. Readers outside of the United States must check the copyright terms of their countries before accessing, downloading or redistributing eBooks. We also have a number of copyrighted titles, for which the copyright holder has given permission for unlimited non-commercial worldwide use. The Project Gutenberg website is for human users only. Use of automated tools to access the website may trigger a block of your access. This site utilizes cookies, captchas and related technologies to help assure the site is maximally available for human users. See full terms of usehere."
Classic Literature,"800 Free eBooks for iPad, Kindle & Other Devices |  Open Culture",2025-03-09,https://www.openculture.com/free_ebooks,"Down­load 800 free eBooks to your Kin­dle, iPad/iPhone, com­put­er, smart phone or eread­er. Col­lec­tion includes great works of fic­tion, non-fic­tion and poet­ry, includ­ing works by Asi­mov, Jane Austen, Philip K. Dick, F. Scott Fitzger­ald, Neil Gaiman, Tol­stoy, Dos­to­evsky, Shake­speare, Ernest Hem­ing­way, Vir­ginia Woolf & James Joyce. Also please see our col­lec­tion1,000 Free Audio Books: Down­load Great Books for Free,where you can down­load more great books to your com­put­er or mp3 play­er. Get the best cultural and educational resources on the web curated for you in a daily email. We never spam. Unsubscribe at any time. FOLLOW ON SOCIAL MEDIA Open Culture scours the web for the best educational media. We find the free courses and audio books you need, the language lessons & educational videos you want, and plenty of enlightenment in between. ©2006-2025 Open Culture, LLC.All rights reserved."
Poetry,Poetry Foundation,2025-03-09,https://www.poetryfoundation.org,"Poems & Poets Poems & Poets Latest Opportunities Women's History Love Grantee-Partner Profile Meet Our Grantee-Partner: One Book One New Orleans One Book One New Orleans increases access to books and improves literacy skills through strategic outreach to adults with low literacy, adults and youth who are incarcerated, and those with visual impairment. Poets on Translation: The (Alter)native Speaker Finding a way to stretch language to fit you and your stray prepositions. To the Brink Prose fromPoetryMagazine Our language reminds us of the legacy that connects us to the past and instills that legacy in this present time. Prose fromPoetryMagazine It isn’t the final product of a poem I’m interested in, but the way poetry can bring community together. Subscribe to Poem of the Day Poetry Magazine Subscribe The Poetry Foundation recognizes the power of words to transform lives. We work to amplify poetry and celebrate poets by fostering spaces for all to create, experience, and share poetry. How We Fulfill Our Mission Featured Poets North America U.S., Western Prose fromPoetryMagazine Submit poetry and letters to the editors ofPoetrymagazine. Submit Stay in the know: subscribe to Poetry Foundation newsletters. Sign Up Receive email news, information, events, and daily poetry from the Poetry Foundation. Start each day with a poem delivered to your inbox! Poems are selected by Poetry Foundation editors and guests to correspond with historic events, poet anniversaries, and more fromPoetrymagazine and the poem archive at PoetryFoundation.org. Access exclusive content from the latest issue ofPoetrymagazine, read poetry-related essays, stay up to date on Foundation news, and more, every Wednesday. Keep up with the Poetry Foundation’s poetry readings, workshops, exhibitions, and other events, sent every other Friday. Monthly during the school year, receive periodic poetry resources and events curated specifically for young people, lifelong learners, and those who work with them. Receive newsworthy updates from the Poetry Foundation. By clicking ""Subscribe,"" you agree to The Poetry Foundation's collection and use of your personal information submitted through this form in accordance with ourTerms of ServiceandPrivacy Policy, which may include use with our online advertising programs. Advertise withPoetry PoetryMagazine PoetryMagazine Archive Submit toPoetry"
