Category,Title,Date,URL,Content
Poetry,poets.org | Academy of American Poets,2025-03-09,https://www.poets.org,"Poetry is the one thing you own; it is the bird in your hand “Hymn of Nature” by Felicia Dorothea Hemans appears in the anthologyThe Young Lady’s Offering; Or Gems of Prose and Poetry(Phillips, Sampson & Company, 1851). In her article, “Hemans, Wordsworth, and the ‘Literary Lady’” (Victorian Poetry, Fall 1997, Vol. 35, No. 3), professor of English at Saint Mary’s University Deborah Kennedy wrote: “The contradictory nature of the life of the nineteenth-century woman poet can be effectively illustrated by the literary and personal relationship between Felicia Hemans andWilliam Wordsworth, two of the most popular poets of the Victorian period. […] Wordsworth disliked Hemans’s ‘too elaborate and studied conversation,’ which he found characteristic of ‘many literary ladies.’ It is possible that she seemed to him ‘elaborate and studied’ because she did not conceal her learning and spoke with the authority of her publicly recognized position rather than showing a proper female deference.” O! Blest art thou whose steps may roveThrough the green paths of vale and groveOr, leaving all their charms below,Climb the wild mountain’s airy brow! And gaze afar o’er cultur’d plains,And cities with their stately fanes,And forests, that beneath thee lie,And ocean mingling with the sky. For man can show thee nought so fair,As Nature’s varied marvels there;And if thy pure and artless breastCan feel their grandeur, thou art blest! For thee the stream in beauty flows,For thee the gale of summer blows;And, in deep glen and wood-walk free,Voices of joy still breathe for thee. But happier far, if then thy soulCan soar to Him who made the whole,If to thine eye the simplest flowerPortray His bounty and His power: If, in whate’er is bright or grand,Thy mind can trace His viewless hand,If Nature’s music bid thee raiseThysong of gratitude and praise; If heaven and earth with beauty fraught,Lead to His throne thy raptured thought;If there thou lovest His love to read;Then, wand’rer, thou art blest indeed! This poem is in the public domain. Published in Poem-a-Day on March 9, 2025, by the Academy of American Poets. 4 poems Come, boys, sing!—Sing of the yellow corn, One does such work as one will not,And well each knows the right;Though the white storm howls, or the sun is hot,The black must serve the white.And it’s, oh, for the white man’s softening flesh,While the black man’s muscles grow!Well I know which grows the mightier, O, rich young lord, thou ridest byWith looks of high disdain;It chafes me not thy title high,Thy blood of oldest strain.The lady riding at thy sideIs but in name thy promised bride.Ride on, young lord, ride on! I’m in my room writingspeaking in myself& I hear youmove down the hallwayto water your plants I write truth on the pageI strike the word over & overyet I worry you’ll pour too much water on the plants& the water will overflow onto the booksruining them If I can’t speak out of myselfhow can I tell you I don’t care about the plants?how can I tell you I don’t care if the books get wet? 5 poets The 2010 winner of the National Book Award in poetry, Terrance Hayes is the author of seven poetry collections. He currently serves on the Board of Chancellors of the Academy of American Poets. Danez Smith is the author ofDon’t Call Us Dead(Graywolf Press, 2017) and[insert] boy(YesYes Books, 2014). Jackie Wang is the author of the poetry collection The Sunflower Cast a Spell to Save Us from the Void (Nightboat, 2021), which was longlisted for the National Book Award. Janice Mirikitani was born on February 4, 1941, in Stockton, California. Chen Chen is the author ofWhen I Grow Up I Want to Be a List of Further Possibilities(BOA Editions, 2017). Since 2018, the Academy of American Poets has invited twelve new Guest Editors to each curate a month of Produced exclusively for our members, the Fall–Winter issue features cover art by Childe Hassam; essays by B. K. Fischer, Eunsong Kim, and Rena Priest. Become a member to receive your digital and physical copy of the most recent issue ofAmerican Poets. … and much more"
Poetry,Poetry Archive,2025-03-09,https://www.poetryarchive.org,"These fine poems, written at different times and from a variety of perspectives, all look hard at the landscapes they enshrine. The Poetry Archive is the only charity wholly dedicated to the production, acquisition and preservation of recordings of significant poets reading their work aloud. We care for and preserve these uniquely valuable voices, which might otherwise be lost, so that future generations can continue to enjoy them. We make our own recordings of poets who write in the English language, and poets also donate copies of their own archives to us so we can look after them in the long term. Hearing how a poet speaks their own poems brings us a deeper level of understanding and enjoyment of the work and provides a rich resource for poetry lovers, explorers, teachers and students of all ages. We have a fundamental belief that poetry is for everyone so, as a charity, the funds we raise are used to record new poets and keep sharing these wonderful collections free-of-charge with you. Ismael Mansoor is a Deaf Poet, he was the British Deaf Association’s BSL Poet Laureate (2024-2025). This World Book Day, the Poetry Archive invites you to celebrate the magic of reading with a collection of poems that explore its power to transport, transform, and inspire. These poems capture the deep and personal relationship between words and… What free verse claims to be free from is the constraints of regular metre and fixed forms. This makes the poem free to find its own shape according to what the poet - or the poem - wants to say, but still allows him or her to use rhyme, alliteration, rhythms or cadences (etc) to achieve the effects that s/he feels are appropriate. There is an implicit constraint, however, to resist a regular metre in free verse - a run of a regular metre will stand out awkwardly in an otherwise free poem. Sometimes known as vers libre, free verse has a long pedigree and is very common in contemporary poetry. Yet there are still voices that claim poetry is only poetry when it is formal verse, and would agree with Robert Frost who, when asked about free verse, said ""I'd just as soon play tennis with the net down"". Fans of free verse can counter with T S Eliot's insistence that ""no vers is libre for the man who wants to do a good job"" - the net may be down, but this allows a poet (of either gender) to play to different rules. Simon Armitage's 'You're Beautiful', for example, creates for himself a set of rules that includes repeated words at the starts of phrases, rather than a structure of repeated sounds at the end of lines. 'What Is Poetry', by John Ashbery, is a good example of free verse - it has neither regular metre nor rhyme, but the exploration of the title's question contains effects based on rhythm and repetition. byWole Soyinka bySharon Olds bySeamus Heaney byAhren Warner by Wole Soyinka by Sharon Olds by Seamus Heaney by Ahren Warner We’re always adding to the Poetry Archive so sign up to our newsletter to keep up to date with the latest archive news, events and releases. Copyright © 2025 All rights reserved. Charity No. 1093858. Registered No. 4336052 The Poetry Archive is a not-for-profit organisation with charitable status. Username or Email Address Password Remember Me Lost your password?"
Children's Books,Scholastic | Books for Kids | Learning Resources,2025-03-09,https://www.scholastic.com,"Don't forget to upgrade your browser This browser is not supported.Download the latest browser below to get the best possible experience. Chrome Safari Firefox Shop Scholastic Book Clubs Rewarding for teachers, easy for families, fun for kidsâ a love of reading is inside every Book Box. The Teacher Store Shop by grade, subject or format to ensure your students have the resources they need. The Scholastic Store Shop best-selling, new, classic and award-winning books and toys for kids of all ages. Scholastic eGift Cards Share the joy of reading instantly with Scholastic eGift Cards. Sign In / Register Hello, Every Order Gives Back to the Class in FREE Books and Resources Place Your Order Everything you need to get kids ready for Kindergarten. OK Readyâ¢ - A NEW subscription box to prepare your 3-5 year old for kindergarten. Teachers, Raise Funds for Books and Resources withÂ ClassroomsCountâ¢ Create a Community of Readers in Your Classroom Shop Now Hundreds of Ideas to Build Their Home Library Â Shop Now Explore stories to help kids understand the world and themselves. Summer reading that's easy, affordable, and engaging Where kids choose their own books and every purchase benefits your school.Â LEARN MORE Ignite student engagement with fresh, high-interest texts and digital media. shop now Support literacy development and inspire learning for all students with our comprehensive literacy solutions. learn more Book Clubs Scholastic Education Teaching Tools The Scholastic Teacher Store Magazines+ Scholastic Teachables Classrooms Count More Less Book Clubs The Scholastic Parent Store Scholastic Parents Book Fairs eGift Cards Klutz More Less Scholastic Kids Scholastic Librarians More Less About Us Careers Media Room Product Safety Customer Service Investor Relations International Scholastic Gives Back Sustainability More Less TM Â® & Â©Scholastic Inc. All Rights Reserved."
Children's Books,BookTrust: Getting children reading | BookTrust,2025-03-09,https://www.booktrust.org.uk,"You currently have JavaScript disabled in your web browser, please enable JavaScript to view our website as intended.Here are the instructions of how to enable JavaScript in your browser. We focus on children from low-income and vulnerable family backgrounds to make sure everyone can experience the lifelong benefits of reading. Reading Rights campaign Resources for schools As the UK's largest children's reading charity, we know that children who read regularly experience better mental wellbeing. They form stronger bonds and relationships. They do better at school and are more creative. Discover the benefits of reading Find out what a difference your donations made to children and families across the country. Take a look Bookstart gifts free books to children at key ages before school to help families read together every day and inspire children to develop a love of books and reading. Find out more Helping vulnerable children discover a love of reading Promoting authors and illustrators of colour BookTrust Storytime is an exciting new library experience for families Get top tips for sharing stories with your child to help them become lifelong readers. Help us make a difference to children throughout the UK. Our work supports every family in Wales from their child’s first year of life. Find out about the Big Welsh Rhyme Time, sharing the benefits of bilingual rhymes, poems and songs with children. Every six months, BookTrust appoints a new Writer or Illustrator in Residence to give us their own unique perspective on the world of children's books. Patrice Lawrence is our current Writer in Residence. Find out how our programmes are helping our partners in Blackpool build parents’ storyt... Authors and scientists Paul Ian Cross and Thomas Bernard discuss the benefits of sharin... 020 7801 8800 [email protected] Sign up to our newsletters full of updates, activities, ways to support us and fun ideas to inspire children to read. Charity number 313343 Copyright © 2024 BookTrust, No. 1 Aire Street, Leeds, LS1 4PR"
Children's Books,Common Sense Media: Age-Based Media Reviews for Families | Common Sense Media,2025-03-09,https://www.commonsensemedia.org,"Common Sense Media Movie & TV reviews for parents Droll, very mature look at sex worker's whirlwind romance. Raucous, violent, darkly comic sci-fi movie about humanity. Lots of language, drugs in ""Ted Lasso""-ish sports comedy. Hero returns in gripping superhero saga; violence, language. Lots of language, drugs in ""Ted Lasso""-ish sports comedy. Hero returns in gripping superhero saga; violence, language. Entertaining, inspiring films that show the value of perseverance and overcoming obstacles. Help kids learn the value of empathy, compassion, and treating others with respect and caring. Read our reviews of the books TikTok influencers love. 71 parent reviews 12 parent reviews 8 parent reviews 23 parent reviews Since 2003, Common Sense has been the leading independent source for media recommendations and advice for families. Look for us next time you're searching for something to watch, read, or play. Not-for-profit partnerships, generous foundation support, and contributions from parents like you keep Common Sense free and available to families everywhere. Common Sense is dedicated to improving the lives of kids and families by providing the trustworthy information, education, and independent voice they need to thrive. We're a nonprofit.Support our work"
Young Adult (YA),Dewa6D â Penawar Game Online Link Toto Dewa 6D Situs Resmi 2025,2025-03-09,https://www.teenreads.com,"Dewa6Dmemberikan pelayanan paling extra maximal dalam menghadirkan penawar game online link toto dewa 6d situs resmi togel pada tahun 2025 mendatang. Daftar dan login link alternatif dewa6d sekarang juga hanya disini. Dewa6d juga menyediakan prediksi togel dari admin togel terpercaya, tebakan angka paling jitu check langsung daftar prediksi togel kami disini. Selain togel, dewa 6d juga menghadirkan sejumlah game online resmi seperti slot resmi, sportsbook, poker, sabung ayam, dan masih banyak lagi. Nikmati layanan live rtp slot berikut dengan informasi pola bermain paling akurat. Dapatkan downloadApk Togelresmi Situs Toto togel ini memiliki banyak pasaran togel resmi yang terpopuler dan sudah banyak di kenal seluruh masyarakat di Indonesia. Berhubung banyak pecinta togel sedangn mencari Situs Togel Terpercaya, resmi , amanah, tentunya membayar semua kemenangan para playernya. Kami Himbau juga agar selalu berhati-hati di luar sana banyak sekali situs abal-abal yang bertebaran di mesin google. Untuk itu kami menegaskan bahwa Dewa6D situs togel online yang sangat kami rekomendasikan untuk para pecinta toto online indonesia."
