Category,Title,Date,URL,Content
Horror & Gothic,Nightmare Magazine - Horror & Dark Fantasy,2025-03-09,https://www.nightmare-magazine.com,"byLincoln Michel Author spotlight They went to the island not to save the marriage—for the marriage hadn’t yet occurred—but to save the possibility of the marriage. It’d been a rough year, Carla knew. The details were banal. Stress at work and stress at home. The economy collapsing. The political system collapsing. The planet burning. Despite all this, when her fiancé, Anton, proposed a vacation, she balked. Stefan Rudnicki and Roxanne Hernandez 0:42:16 Advertisement byWendy N. Wagner David Lynch did not come up with the line “The owls are not what they seem.” It was co-creator Mark Frost who wrote the teleplay for that episode ofTwin Peaks. But seemings and doublings are a primary occupation of Lynch’s work. That’s why when I sat down to write about this month’s issue, I immediately thought of him—and the owls. These stories and this poem are also not what they seem. by Samir Sirk Morató Little is more crushing than the idea that no matter what you do, you are only capable of destruction, and everyone knows it. I wanted to weave that fear into this story, and to push tenderness and violence up against each other. How can we understand one without understanding the other? (available on 3/12) |Buy Ebook To Read it Now by Ana Hurtado It hides from me deep below. Amidst bubbles and foam, a skull of gills and scales and spine stashes away under waves of blue. Do we share the same creases beneath our eyes, the ones that feel like gashes in the mornings? Is salt buried above its cheeks? When it swims and breathes does it choke like me, now? Like me, before? And when it cries and screams does the ocean swallow it all up, too? (available on 3/19) |Buy Ebook To Read it Now by Zoe Kerr In late 2023, I noticed a new subgenre on the horizon, emerging from the intersection of celebrity culture and horror. I call it “Stage Fright”—save the groans, it’s a working title. With the release ofTrap, Smile 2, andMaXXXine, this new wave reflects a zeitgeist increasingly disillusioned with the glittering facades of billionaires and icons, and eagerly tuning in when these stars find themselves ensnared in tragic circumstances. (available on 3/12) |Buy Ebook To Read it Now by J.B. Kish Guest reviewer J.B. Kish shines a spotlight on a French horror film you might have missed:MadS. Find out why it’s a must-see on for both film nerds and horror fans! (available on 3/26) |Buy Ebook To Read it Now by Josh Pearce This piece comes from a childhood of taking piano lessons. I switched to other instruments after high school, but I still remember how to read sheet music. (available on 3/26) |Buy Ebook To Read it Now Advertisement Advertisement Advertisement Advertisement Advertisement Advertisement Advertisement JOIN US!"
Graphic Novels & Comics,Comic Book Herald - A Comic Book Reading Order Guide For Beginners & Fans,2025-03-09,https://www.comicbookherald.com,"A Comic Book Reading Order Guide For Beginners & Fans The comic bug bites again! I OD'd so hard on Marvel Rivals that I finally shook off my disinterest in reading all the latest and greatest comics! Doesn't hurt that 2025 is off to a roaring start with must-read graphic novels from the likes of Kieron Gillen, James Tynion IV, Jeff Lemire, Juni Ba... …[Read More...]about My Favorite Graphic Novels of February 2025 More Comic Book Reading! Just when I think I'm out on Marvel-616 events... Ryan North's excellent Fantastic Four pulls me back in! I wasn't planning on falling headfirst for a Marvel event outside the Ultimate 2niverse in 2025, but North's Fantastic Four has been so good (it's one of my favorite comics of 2024!), and I'm …[See the Reading Order!]about One World Under Doom (2025) Reading Order Welcome to the Comic Book Herald Complete Marvel Reading Order Guide. Some quick words of explanation that should help answer the most frequent questions. In the years I've worked editing and updating this guide, I've focused primarily on the modern era of comics from the late 90's through the …[See the Reading Order!]about The Complete Marvel Reading Order Guide Marvel took C2e2 2019 by storm with the in-person announcement that writer Jonathan Hickman is returning to the publisher to write two congruent X-Men series. From 2008 to 2015, Hickman stood out as one of the best Marvel Universe writers, delivering impressive work across titles like Fantastic …[See the Reading Order!]about Jonathan Hickman X-Men Reading Order! Let's face it: Batman is the coolest. Even for a comic book fan like me, one who spends an inordinate amount of time fixated on the Complete Marvel Universe, reading Batman is almost always a good decision. It's no surprise there are 6 (nearly 7) Batman stories within my top 50 of the best comics …[See the Reading Order]about Batman Reading Order March 3, 2025ByComic Book Herald StaffLeave a Comment Dave & Charlotte spend a Zack-less episode SHIELDing themselves for his Glorious Return (also talking about the comics). February 24, 2025ByDaveLeave a Comment Charleader and Zacktain America discuss a Dave New World! Is the MCU back? Did it ever leave? Where am I?! All these questions and more! February 17, 2025ByComic Book Herald StaffLeave a Comment Hulkdad and his Failhulks run amok. February 10, 2025ByComic Book Herald StaffLeave a Comment Charlotte & Dave conduct a siege on Zack’s heart… but will they be able to shatter his defenses?? February 3, 2025ByDaveLeave a Comment BOYS NIGHT! Dave and Zack watched the new Friendly Neighborhood Spider-Man on Disney+, read all the DC Absolute Universe comics, and finally solved the horniness for Marvel Rivals Squirrel Girl. February 1, 2025ByDaveLeave a Comment For those who were wondering, it turns out I read so many comics last year primarily because I wasn’t spending every free hour playing Marvel Rivals or The Legend of Zelda: Tears of the Kingdom (or even reading a *gulp* prose novel, Cloud Atlas!). Video games are simply winning the “Would you rather?” battle right […] January 27, 2025ByComic Book Herald Staff2 Comments Zack rains his furious fists down on Dave’s pitiful defense of Iron Fist… will Charlotte use her superior strength to intervene? Find out this week on My Marvelous Year! Also, everyone’s favorite hot synthetic horse is here! Take it from someone who's tried: If you want to read the complete history of Batman in comics, and you don't want to do it digitally, you have your work cut out for you! Take a look at Comic Book Herald's complete Batman reading order and you'll see …[Read the Review]about Collect The Complete DC Comics Reading Order Through DC Finest Collections There is an oft-repeated belief that Cyclops was the villain of the Revolution era of X-Men comics—the period mostly written by Brian Michael Bendis that includes Uncanny X-Men volume 4, All New X-Men, and to a lesser extent, Jason Aaron’s Wolverine …[Read the Review]about Rage and Revolution: Cyclops Was Never The Villain of Bendis Era X-Men Every week in the Comic Book Herald newsletter, I write a column called ""A Dave in the Life,"" where I explore the issues or news in comics. Now, you can also find these columns published here on CBH. To get the full newsletter alongside reading …[Read the Review]about A Dave in the Life: Peter or Miles? Who Wins Spider-Man 2? There is something both incredibly heartwarming and deeply frustrating about Across the Spider-Verse's transness. Let's start with the heartwarming part: as a trans woman myself, as well as a Spider-Gwen fan who has for many years now interpreted …[Read the Review]about Spider-Gwen & the Trans Subtext of Spider-Man: Across the Spider-Verse The third season of X-Men: The Animated Series is a showcase of all the qualities that make the series memorable in their distilled, purest forms. Season-long plots? Here in spades. Multi-episode story arcs? We’ve got four of those, including …[Read the Review]about X-Men: The Animated Series Season 3 Rewatch! More Comic Book Reviews! First Name Email address: DC Rebirth Guide Batman Reading Order DC New 52 Reading Order Marvel Ultimate Universe Guide Civil War Reading Order Marvel Cosmic Reading Order The Best Comics of All Time! Deadpool Reading Order Justice League Reading Order Complete Thanos Reading Order X-Men Reading Guide (Modern Era) Age of Apocalypse Reading Order Best Tablet For Digital Comics Is Marvel Unlimited Worth It? Copyright © 2025 ·Metro ProonGenesis Framework·WordPress·Log in"
Self-Help & Personal Development,SUCCESS | Your Trusted Guide to the Future of Work,2025-03-09,https://www.success.com,"Save Up to 20% Before Oct. 2! byJeet Kumar Ambasth bySusan B. Barnes byMegan Marshall 1 2 3 Check out the full list of SUCCESS®Bestsellers in business,personal development, finance, leadership, and more. Dive deep into the heart of our brand with the latest trends and entertainment, sneak peeks into upcoming projects, and exclusive insights that only our email subscribers get to enjoy. Get exclusive access to world-class speakersthrough the SUCCESS Speakers Bureau. 5473 Blair Road, Suite 100PMB 30053Dallas, TX 75231 Copyright © 2025 SUCCESS Magazine. All rights reserved. Save Up to 20% Before Oct. 2! Copyright © 2024 SUCCESS Magazine. All rights reserved. Unlock the Latest Knowledge that Can You Help You Achieve More in Life with More Confidence Print and Digital Options Available You’vereached your limitoffreearticles for this month! (plus get access to hundreds of resources designedto help you excel in life and business) Please enter your username or email address. You will receive an email message to log in. No, thanks,I’m not interested in personal growth. Plus, get access to daily inspiration, weekly newsletters and podcasts, and occasional updates from us. By signing up you are also added to SUCCESS® emails. You can easily unsubscribe at anytime. By clicking above, you agree to our Privacy Policy and Terms of Use. Please enter your username or email address. You will receive an email message to log in. Get unlimited access to SUCCESS®(+ a bunch of extras)! Learn more. Please enter your username or email address. You will receive an email message to log in. The exclusive article you’re trying to view is for subscribers only. (plus get access to hundreds of resources designedto help you excel in life and business) Please enter your username or email address. You will receive an email message to log in."
Self-Help & Personal Development,James Clear,2025-03-09,https://jamesclear.com,"Packed with self-improvement strategies,Atomic Habitswill teach you how to make the small changes that will transform your habits and deliver remarkable results. I’m the author of the #1 New York Times bestseller,Atomic Habits, which has sold more than 20 million copies worldwide. My work has been featured in places like Time magazine, the New York Times, the Wall Street Journal and on CBS This Morning.Click here to learn more about me and my work. Get started today with the official Atomic Habits app based on the NYT best-seller that has already helped over 20 million people."
Self-Help & Personal Development,LifeHack - Get the most out of life. Fast.,2025-03-09,https://www.lifehack.org,"LifeHack is an AI-powered life coach enhanced by human expertise, designed to help you set and achieve meaningful goals. We deliver custom strategies and daily action plans to help busy professionals turn aspirations into reality. LifeHack’s 360 Assessment pinpoints yourmost importantgoals, challenges, and support needs, laying the groundwork for your tailored growth journey. Sarah, let’s figure how to help you feel more fulfilled both as aleader and a parent.Here’s my recommended 3-month blueprint for you: Put time on your side.Our AI Coach serves up focused actions that actually fit your hectic life. Wake up to personalized to-dos, conquer bite-sized goals, and watch your progress snowball – even on your busiest days. I’ve planned3 easy actionsfor you today to help you move the needle.Try these! Subscribe withconfidence: 100% refund for the first 15 days, no questions asked. Having an off-day? Feeling stuck? Our library of targeted prompts help you overcome mindset obstacles. Getinstant AI insightsor opt forhuman coachfeedbackto push past any hurdle. Do you need more help, Sarah? Let me give you some personalized actions strategies to try this week. In ourPremium Learning Hub, get access to a wealth of knowledge on demand. From bite-sized lessons tocomprehensiveonline coursestaught by our experienced human coaches. Sarah, review this lesson this week. Let’s break down where your time sinks are really coming from. Join LifeHack today and start your journey from questions to actions. Reflect deeply, get insightful feedback, and use our powerful tools to achieve your goals. Take the first step in uncovering your true strengths and potential through our insight-rich complimentary resources. Gain deep insights into your strengths, weaknesses, and opportunities for growth with our personalized assessments, tailored to your unique situation. Craft personalized, achievable goals with our intelligent SMART Goal Generator, designed to help you set and achieve meaningful, realistic goals. Pinpoint the most significant drains on your time using our powerful “Find Your Biggest Time Killer” tool, and develop strategies to eliminate them for good. Are you honoring your deepest priorities? Our eye-opening Life in Weeks chart will reframe your journey – simply enter your birthday. Begin your path to self-discovery with LifeHack. Engage in meaningful reflections, obtain valuable feedback, andleverageour robust tools to turn your aspirations into reality. Time is life. When your time quality is poor, your life suffers. LifeHack’s takes a time-centric approach that goes beyond generictime managementsolutions. Are you struggling with any of the problems below? Do you feel unfulfilled despite your impressive achievements and success? Many high-achievers find themselvesfeeling emptyand disconnected from their authentic selves, even after ticking off all the conventional “success” boxes. Procrastination can hinder the growth andproductivityof even the most driven professionals. If you find yourself constantly putting things off, you’re not alone. Break the cycle and reach your full potential with our powerful solution. Balancing career, family, and personal life can feel like an uphill battle for driven professionals. Constantly juggling responsibilities and running on empty puts your well-being at risk. Discover how to find equilibrium and make time for what matters most. Do you feel trapped in survival mode, constantly juggling career, family, and personal priorities? You’re not alone. Break free from theburnoutcycle and discover how to thrive, not just survive. Sample game-changing tips for time-life mastery Terms & Conditions·Privacy Policy"
Book Reviews & Recommendations,BOOK RIOT - Book Recommendations and Reviews,2025-03-09,https://bookriot.com,"It's not just the content of news or press releases we need to care about. We need to understand its origins matter, too. That, plus this week's book censorship news. Celebrate Women's History Month with these outstanding comics about trans women. If you like scary books, March's new horror releases are a nightmare-fueled dream come true. YA books for younger teens exist, though there are many reasons why they're not always easy to find. Place your preorders and library holds now: these are three of the buzziest new books out in spring 2025. From historical mysteries and historical supernatural horror to historical romance, there's a little something for everyone. Since ChatGPT launched in late 2022, it has changed the way people think about plagiarism. The nonfiction out this month includes Scaachi Koul’s new funny/sincere essay collection, a survivor's memoir, unique cookbooks, and more."
Book Reviews & Recommendations,Kirkus Reviews,2025-03-09,https://www.kirkusreviews.com,"Browse by Genre Popular Content Popular Genres Browse by Content Type Winners & Finalists General Information Pre-publication book reviews and features keeping readers and industry influencers in the know since 1933. Resources & Education Services for Authors Kirkus Diversity Collections Kirkus Pro Connect NONFICTION FICTION NONFICTION SCIENCE FICTION & FANTASY NONFICTION NONFICTION FICTION ROMANCE NONFICTION NONFICTION FICTION FICTION SCIENCE FICTION & FANTASY FICTION NONFICTION NONFICTION NONFICTION NONFICTION NONFICTION NONFICTION HOT THIS WEEK HOT THIS WEEK FIND YOUR NEW FAVORITE BOOK TOP STORY HOT THIS WEEK FIND YOUR NEW FAVORITE BOOK START HERE SELECT TOP STORY TOP STORY Our Verdict Our Verdict Our Verdict Our Verdict Our Verdict Our Verdict Our Verdict Our Verdict Our Verdict Our Verdict Our Verdict Our Verdict Our Verdict Our Verdict Our Verdict FULLY BOOKED PODCAST March 4, 2025 Laila Lalami discusses ‘The Dream Hotel’ on our Best March Books episode. LISTEN AND SUBSCRIBE ONSPOTIFY,APPLE,AMAZON MUSIC, ORPODCASTONE MORE EPISODES Feb. 25, 2025 The personal is cyclical: Lidia Yuknavitch makes a triumphant return to memoir. Feb. 18, 2025 Novelist Erin Crosby Eckstine joins us for a special episode celebrating debuts. Feb. 11, 2025 Paul Lisicky contemplates the profound influence of Joni Mitchell on his life and work. INSIDE SCOOP INSIDE SCOOP The Magazine:Kirkus Reviews Featuring 302 industry-first reviews of fiction, nonfiction, children’s, and YA books; also in this issue: interviews with Jojo Moyes, John Green, Saadia Faruqi, and Ashley Hope Pérez; and more The Kirkus Star One of the most coveted designations in the book industry, the Kirkus Star marks books of exceptional merit. The Kirkus Prize The Kirkus Prize is among the richest literary awards in America, awarding $50,000 in three categories annually. Be the first to read books news and see reviews, news and features inKirkus Reviews. Get awesome content delivered to your inbox every week. © Copyright 2025 Kirkus Media LLC.All Rights Reserved. Follow Popular in this Genre Hey there, book lover. We’re glad you found a book that interests you! OR We can’t wait for you to join Kirkus! It’s free and takes less than 10 seconds! Already have an account?Log in. OR Trouble signing in?Retrieve credentials. Already have an account?Log in. Welcome Back! OR Trouble signing in?Retrieve credentials. Don’t fret. We’ll find you. All Users Magazine Subscribers (How to Find Your Reader Number) If You’ve Purchased Author Services Don’t have an account yet?Sign Up."
Book Reviews & Recommendations,Book Review - The New York Times,2025-03-09,https://www.nytimes.com/section/books/review,"Advertisement Supported by In her memoir, “Raising Hare,” Chloe Dalton describes how a leveret changed her outlook on life during the pandemic and beyond. ByJ. D. Biersdorfer In a new essay collection, A. Kendra Greene translates her experiences of our bizarre and marvelous world. ByCarlene Bauer Our critic on Deanna Raybourn’s “Kills Well With Others” and three more new books. BySarah Weinman In “Air-Borne,” his detailed and gripping account of aerobiology, Carl Zimmer uncovers the mysteries filling our lungs. ByRobert Sullivan 6 New Books We Recommend This Week Suggested reading from critics and editors at The New York Times. A New Novel After the Nobel? No Pressure, Says Abdulrazak Gurnah. But a full calendar meant carving out time for “Theft,” his new book and first since winning the prize. Let Us Help You Find Your Next Book: Romance Whether you're looking for a classic or the latest and greatest, start here. ByThe New York Times Books Staff Let Us Help You Find Your Next Thriller Whether you're looking for a classic or the latest and greatest, start here. ByThe New York Times Books Staff Let Us Help You Find Your Next Book Reading picks from Book Review editors, guaranteed to suit any mood. ByThe New York Times Books Staff Advertisement A Nanny on the Run With Someone Else’s Daughter “The Tokyo Suite” explores class divisions in contemporary Brazil via the twinned stories of a high-powered TV executive and the desperate caretaker of her child. ByAlexandra Jacobs Trump Is Changing America From the Top. These Groups Did It From the Bottom. A new book by the historian Linda Gordon considers seven social movements that transformed the country — not all of them for the better. ByJennifer Szalai ‘My 10,000 Hours’: The Diaries That Made Helen Garner a Writer “How to End a Story” collects three volumes of the Australian novelist’s self-conscious, sometimes harrowing journals. ByDwight Garner Chimamanda Ngozi Adichie Aims to ‘Write a Wrong’ in ‘Dream Count’ In her first novel since “Americanah,” she draws on a real-life assault case as she follows the lives of three Nigerian women and one of their former housekeepers. ByAlexandra Jacobs How ‘Right-Wing Women’ Found Their Place in the Manosphere In a newly reissued 1983 book, the radical feminist Andrea Dworkin argued that conservative women understood the reality of male domination. ByJennifer Szalai Merle Oberon was a popular actress who was once nominated for an Oscar. But a fact that she hid from the public threatened to unspool her entire life’s work. ByAnna Kodé An indefatigable gardener, she was one of the first nutritionists to emphasize the connections between farming practices and consumers’ health. ByJoanne Kaufman A memoir of Italy; notes on Canada. The best-selling bard of female anxiety rakes over some middle school memories while visiting the city where she grew up. ByEmma Goldberg In “Stag Dance,” Torrey Peters probes the complicated, evolving realities of queerness and trans life. ByHugh Ryan Her “Codependent No More: How to Stop Controlling Others and Start Caring for Yourself,” a guide to shedding toxic relationships, has sold more than seven million copies. ByRichard Sandomir A Caldecott Medal winner, he turned childhood memories of fleeing the Nazis in Poland into magical stories. ByAlex Williams Every season brings its share of books to look forward to, and this spring is no different. On this episode Gilbert Cruz and Joumana Khatib talk about a dozen or so titles that sound interesting in the months ahead. Fifteen years ago, Kathryn Stockett’s debut novel became a best seller, but was also heavily criticized for its portrayal of Black characters. Now, she has written second novel, “The Calamity Club.” ByAlexandra Alter In Linda Joan Smith’s “The Peach Thief,” an orphaned girl posing as a boy raids an English Eden. ByJennifer Howard Advertisement Best Sellers Book Review Podcast By the Book Crime Children's Books Advertisement Subscribe to the Book Review Books F.A.Q. Email the Book Review Every Friday, be the first to see reviews, news and features in The New York Times Book Review."
Publishing & Writing,"The Creative Penn. Writing, Publishing, Book Marketing and Making a Living with your Writing",2012-06-29T19:41:07+00:00,https://www.thecreativepenn.com,"The Creative Penn Writing, self-publishing, book marketing, making a living with your writing I'm Joanna Penn, and through my books, podcast and community, I'll share my lessons learned on how to write, publish and market your book — and make a living with your writing. I'm an award-winning, New York Times and USA Today bestselling author with more than 40 books across multiple genres, with over a million sold across 176 countries and 5 languages. I'm a podcaster, international speaker, and award-winning creative entrepreneur. But it hasn't always been this way! I've made many mistakes on the author journey, and I share everything on this site so you can save time, money, and heartache on your path. Tips and resources on writing, publishing, book marketing, and making a living with your writing. My list of the best writing and editing, publishing and marketing software for writers, plus in-depth tutorials on how to use them. Subscribe in your favorite podcast app, or check out the backlist. IncludingHow to Make a Living with Your Writing,How to Market a Book,Successful Self-Publishing,How to Write Non-Fiction, and many more. This site has hundreds of articles, audio podcast episodes, videos and resources. To help you get started with the most useful content for your author journey, go straight to Start Here! Check out my fiction and travel memoir as J.F. Penn Continue ReadingWriting Action Adventure And Traveling For Book Research With Luke Richardson Continue ReadingKickstarter For Authors With Oriana Leckert Continue ReadingThe Happy Writer With Marissa Meyer Continue ReadingThe Evolving Author And Second Editions. Joanna Penn On The Indy Author Podcast Save Save"
Publishing & Writing,Untitled Article,2025-03-09,https://www.nanowrimo.org,
