Category,Title,Date,URL,Content
Fiction,Goodreads | Meet your next favorite book,2025-03-09,https://www.goodreads.com,"You’re in the right place. Tell us what titles or genres you’ve enjoyed in the past, and we’ll give you surprisingly insightful recommendations. Chances are your friends are discussing their favorite (and least favorite) books on Goodreads. Because Shomeret liked… She discovered: Psychology, Animals, Science, Nature Because ♥Meagan♥ liked… She discovered: Historical Fiction, Book Club More book lists Gain access to a massive audience of book lovers. Goodreads is a great place to promote your books. Welcome back. Just a moment while we sign you in to your Goodreads account."
Fiction,Homepage - Reactor,2025-03-09,https://www.tor.com,"Advertisement Science fiction. Fantasy. The universe. And related subjects. The Reactor newsletter is the best way to catch up on the world of science fiction, fantasy, pop culture, and more! Kochin is a heartsooth—a rare being with the ability to heal any wound. Any wound, that is, exce... Werewolves, queens, and assassins are just some of the interesting folks you'll encounter in Mar... Hedgewitch apprentices, engineers, students, and paranormal investigators all appear in March's... A queer standalone YA fantasy full of pirates and sea-magic—and one terrifying monster. The world of teen horror is a scary place, especially in tales of isolation... Works on Ancient Greece to the Inquisition and the Renaissance, WWII to the present day… When Colin meets a shadowy figure promising him his heart’s deepest desire, he can’t resist... Lanie Stones is the necromancer that Death has been praying for… In this tender, eerie, and hard-to-classify novel, two sisters live in the Garden, isolated from... France is under water, Korea is reunited, and a meteorite has struck Washington, D.C. in March's... The roots of this one go all the way back to Revelation... When does a genre literary trope cross the threshold into marketing trend? A woman about to leave on an overseas business trip, calls home from the airport and discovers t... A new story set in the world of “The Red Mother.” Hacksilver riddled with a dragon, saved his fa... A pair of sisters are hired to find--and if necessary, dispose of--whatever is killing neighborh... The spirit of a recently deceased young boy helps a group of ghosts seek revenge on a corrupt an... Mel relishes running the “Enchanted Jungle,” a roadside attraction in the Everglades filled with... Teenage Graff dreams of going off-world to explore the universe as a documentarian, but he never... A woman losing her sight turns to small family magics to save the lives of those she loves the m... In one small town, the delicate balance between predator and prey is threatened when five girls... The Reactor newsletter is the best way to catch up on the world of science fiction, fantasy, pop culture, and more! “You want stories?"" Thom Merrilin declaimed. ""I have stories, and I will give them to you. I will make them come alive before your eyes.” Robert Jordan, The Eye Of The World TPG 2025•Site Credit For compliance with applicable privacy laws:"
Fiction,Literary  Hub,2025-03-09,https://lithub.com,"Featuring Brad Johnson, Emily Temple, James Folta, and Drew Broussard In Praise of an Early Poetic Chronicler of Black Queer Life Rebecca Worby on Will Stratton’s “Points of Origin” Featuring Chimamanda Ngozi Adichie, Laila Lalami, Chloe Dalton, and More Jennifer Lucy Allan on the Millennia-Long Relationship Between Humans and Hands-On Creation Nick Thorpe Explores the Intersections of Geography and Culture in Central and Eastern Europe Remembering an Award-Winning Writer Who Sacrificed Her Life For Justice Created by Grove Atlantic and Electric Literature Masthead About Sign Up For Our Newsletters How to Pitch Lit Hub Advertisers: Contact Us Privacy Policy Support Lit Hub - Become A Member"
Non-Fiction,"Books: Book Reviews, Book News, and Author Interviews : NPR",2025-03-09,https://www.npr.org/sections/books,"November 25, 2024 •Books We Love returns with 350+ new titles handpicked by NPR staff and trusted critics. Find 12 years of recommendations all in one place — that's nearly 4,000 great reads. A review card of Virginia Woolf's 1925 novelMrs. Dalloway, written by a Los Angeles Public Library staff member around the time of the book's publication.James Sherman/Los Angeles Public Libraryhide caption March 8, 2025 •The Los Angeles Public Library stores thousands of index cards with staff reviews of books dating back to the 1920s. A librarian explains how they were used and what we can learn from them today. March 6, 2025 •Author Zadie Smith says she'll miss being young. In this week'sWild Card, Smith opens up about having enough time and growing older. Tina FeyMary Ellen Matthewshide caption March 5, 2025 •Mary Ellen Matthews has beenSNL's photographer for 25 years. In a new book,The Art of the SNL Portrait, she shares her most iconic celebrity photos, like Pete Davidson eating pasta. Pulitzer Prize winner andTo Kill A Mockingbirdauthor Harper Lee smiles before receiving the 2007 Presidential Medal of Freedom at the White House on Nov. 5, 2007.Chip Somodevilla/Getty Imageshide caption March 4, 2025 •The beloved author ofTo Kill a Mockingbirdfamously only released two novels in her lifetime. Now, the world will get to read more of Lee's work with an upcoming release of short stories and essays. Chimamanda Ngozi Adichie on the themes of her new novel, Dream Count: ""I wanted to write about women's lives. And the reality of it is that for many women, the men in their lives in some ways, shape their lives.""Ulf Andersen/Getty Imageshide caption March 4, 2025 •Celebrated Nigerian writer Chimamanda Ngozi Adichie speaks with NPR's Michel Martin about her new book, ""Dream Count."" March 4, 2025 •Linda Holmes knows what goes into a good romantic comedy. Linda has written about pop culture for more than 20 years and is a huge fan of the genre. She's also written romantic comedy novels herself. Linda joins us on Bullseye to discuss her latest novelBack After This. She breaks down the clichés that make rom-coms great and the tropes that make them stink. Hanif Kureishi says his fall in 2022 didn't rob him of his ability to function or be creative: ""In fact, I'm writing more now.""Kier Kureishi/Harper Collinshide caption March 3, 2025 •Kureishi began his new memoir just days after a fall left him paralyzed. In it, he describes being completely dependent on others — and the sense of purpose he's gained from writing. Jordan Chiles of Team USA reacts after finishing her routine on the uneven bars during the Olympic Games in Paris 2024.Jamie Squire/Getty Imageshide caption March 3, 2025 •Olympic gymnast Jordan Chiles shares her up-and-down journey to the 2024 Paris Games and what happened afterward, in her new memoir, ""I'm That Girl: Living the Power of My Dreams."" ""I have a lot to think about the relationship between mourning, between grieving, and between pain, generally speaking, and bilingualism and living in a different language,"" says Pulitzer winner Cristina Rivera Garza aboutDeath Takes Me,her newly translated novel.Penguin Random House.hide caption February 27, 2025 •Pulitzer winner Cristina Rivera Garza offers new perspective on gender violence through a murder mystery and poetry. February 26, 2025 •Formerly enslaved people would placed ads in newspapers hoping to find lost children, parents, spouses and siblings. Historian Judith Giesberg tells the stories of some of those families in a new book. February 24, 2025 •Live Fastwon France's top literary prize in 2022. Brigitte Giraud's haunting book revisits the death of her husband in a motorcycle crash 20-odd years earlier. February 23, 2025 •This year brings memoirs from more than a dozen famous names — from Brooke Shields and Dawn Staley to Bill Belichick and Lionel Ritchie. Rare book collector Rebecca Romney holdsThe Mysteries of Udolphoby Ann Radcliffe, published in 1794. The novel is among the archives that inspiredJane Austen's Bookshelf, Romney's new book on the women writers who influenced Austen.Valerie Plesch for NPRhide caption February 21, 2025 •""Jane Austen's Bookshelf"" spotlights eight women writers, largely lost to history, who influenced the English novelist. The Kennedy Center on Aug. 13, 2019, in Washington, D.C.Jacquelyn Martin/APhide caption February 20, 2025 •A spokesperson for the Kennedy Center says the threat targeted Shen Yun, a touring dance troupe that is banned in China, because it is associated with the religious group Falun Gong. February 20, 2025 •Malinda Russell'sA Domestic Cookbookwas first published in 1866. It contains least a hundred recipes for sweets, plus recipes for shampoo and cologne – and remedies for toothaches. Author Eric Puchner's new novel,Dream State,is about a love triangle that tests the decades-long friendship of two college friends.Justin T. Gellerson for NPRhide caption February 19, 2025 •Eric Puchner's new novel,Dream State, was just named the latest Oprah book club pick. It's about a love triangle that tests the decades-long friendship of two college friends. Memorial Days, by Geraldine BrooksPenguin Random Househide caption February 18, 2025 •Horwitz died suddenly in 2019 while on a book tour. InMemorial Days, Geraldine Brooks grieves her husband — and also reflects on the life she might have lived had they not met. February 14, 2025 •Fan fiction — unsanctioned, unofficially published works based on popular novels or films — was intentionally never mainstream. The coming months will see a trio of titles by popular Draco and Hermione — Dramione — fanfic authors. Salman Rushdie presented his book Knife at El Ateneo Library, in Madrid on May 20, 2024.Cesar Luis de Luca/Picture alliance/Getty Imageshide caption February 10, 2025 •Hadi Matar, who is on trial for the knife attack against the British author, has also been accused of supporting terrorism and attempting to carry out a fatwa calling for Rushdie's assassination. Tom Robbins, at a 2014 reading of his memoirTibetan Peach Pieat Powell's Books at Cedar Hills Crossing in Beaverton, Ore.Alex Milan Tracy/APhide caption February 9, 2025 •Robbins dazzled readers with the whimsy and imagination in his books, includingJitterbug Perfume, Skinny Legs and AllandEven Cowgirls Get the Blues. February 9, 2025 •For centuries, scholars only had one version of the life of Margery Kempe, an English mystic who lived in the 14th and 15th centuries — until a ping pong match revealed her story in her own words. Kids' books author Mac Barnett is the new National Ambassador for Young People's LiteratureChris Black/Library of Congresshide caption February 6, 2025 •The Library of Congress has given Mac Barnett the job of promoting books and reading to kids across the country. His plan is to focus on picture books. February 6, 2025 •Kay Sohini's graphic memoir,This Beautiful, Ridiculous City,tells a story of migration and redefinition. Gay Talese gathers many of his great pieces about the city inA Town Without Time. Sponsor Message Become an NPR sponsor"
Non-Fiction,Books | The Guardian,2025-03-09,https://www.theguardian.com/books,
Non-Fiction,"Culture: TV, Movies, Music, Art, and Theatre News and Reviews | The New Yorker",2025-03-09,https://www.newyorker.com/books,"Sections More ©2025Condé Nast. All rights reserved.The New Yorkermay earn a portion of sales from products that are purchased through our site as part of our Affiliate Partnerships with retailers. The material on this site may not be reproduced, distributed, transmitted, cached or otherwise used, except with the prior written permission of Condé Nast.Ad Choices"
Science Fiction & Fantasy,Homepage - Reactor,2025-03-09,https://www.tor.com,"Advertisement Science fiction. Fantasy. The universe. And related subjects. The Reactor newsletter is the best way to catch up on the world of science fiction, fantasy, pop culture, and more! Kochin is a heartsooth—a rare being with the ability to heal any wound. Any wound, that is, exce... Werewolves, queens, and assassins are just some of the interesting folks you'll encounter in Mar... Hedgewitch apprentices, engineers, students, and paranormal investigators all appear in March's... A queer standalone YA fantasy full of pirates and sea-magic—and one terrifying monster. The world of teen horror is a scary place, especially in tales of isolation... Works on Ancient Greece to the Inquisition and the Renaissance, WWII to the present day… When Colin meets a shadowy figure promising him his heart’s deepest desire, he can’t resist... Lanie Stones is the necromancer that Death has been praying for… In this tender, eerie, and hard-to-classify novel, two sisters live in the Garden, isolated from... France is under water, Korea is reunited, and a meteorite has struck Washington, D.C. in March's... The roots of this one go all the way back to Revelation... When does a genre literary trope cross the threshold into marketing trend? A woman about to leave on an overseas business trip, calls home from the airport and discovers t... A new story set in the world of “The Red Mother.” Hacksilver riddled with a dragon, saved his fa... A pair of sisters are hired to find--and if necessary, dispose of--whatever is killing neighborh... The spirit of a recently deceased young boy helps a group of ghosts seek revenge on a corrupt an... Mel relishes running the “Enchanted Jungle,” a roadside attraction in the Everglades filled with... Teenage Graff dreams of going off-world to explore the universe as a documentarian, but he never... A woman losing her sight turns to small family magics to save the lives of those she loves the m... In one small town, the delicate balance between predator and prey is threatened when five girls... The Reactor newsletter is the best way to catch up on the world of science fiction, fantasy, pop culture, and more! “You want stories?"" Thom Merrilin declaimed. ""I have stories, and I will give them to you. I will make them come alive before your eyes.” Robert Jordan, The Eye Of The World TPG 2025•Site Credit For compliance with applicable privacy laws:"
Science Fiction & Fantasy,Locus Online – The Magazine of the Science Fiction and Fantasy Field,2025-03-09,https://www.locusmag.com,"The Magazine of the Science Fiction and Fantasy Field The five-title 2025 PEN/Faulkner shortlist for fiction has been announced, with titles and authors of genre interest, includingGhostrootsby ’Pemi Aguda (Norton) andJamesby Percival Everett (Doubleday). The prize “honors the best published works of fiction by American citizens in a calendar year.” This year’s judges are Bruce Holsinger, Deesha Philyaw, and Luis Alberto Urrea. The “first among equals” winner will be announced in April. The finalists and Galaxy Raiders: Abyss, Ian Douglas (Harper Voyager 978-0063205741, trade paperback, 400pp, $18.99) February 2025 I think most folks are well aware of how SF/F/H concepts trickle out into the public domain, and percolate through the minds of citizenry who might never have read a relevant book or even experienced a relevant media presentation. Take “teleportation,” for instance. Once an abstruse notion that meant nothing to the average citizen of...Read More Analog 11-12/24 “That Far, Uncharted Ocean” byAuston Haber­shawin the November/December issue of Analog features recurring characters and a world appear­ing in previous Analog stories by the author. Amos Tambly is recruited by the Thraad, snaillike aliens, who want to win a sailing regatta but have no knowledge of boats and are afraid of the ocean. Amos agrees, but ultimately learns that the Thraad intend to wipe...Read More Zodiac Rising, Katie Zhao (Random House 978-0-593-64641-0, $19.99, 416pp, hc) October 2024. Cover by Deb JJ Lee. Author Katie Zhao opens her young adult fantasy thrillerZodiac Risingwith a brief prologue ex­plaining the history behind 12 Chinese warriors, based on the zodiac calendar, who were sum­moned centuries ago in response to a royal plea to battle monsters known as Wrathlings. Their lineage brought peace to the land until...Read More Keith Roberts’s Pavane: A Critical Compan­ion, Paul Kincaid (Palgrave Macmillan 978-3031715662, $37.99, 86pp, hc) November 2024. For the past couple of years, Palgrave has been publishing a series of short “critical companion” monographs each focusing on a single title of what it calls the “new canon”; books covered so far includeThe Last Unicorn,Dune,The Hobbit,Neuromancer,Neverwhere,The Stars My Desti­nation,...Read More Goblins & Greatcoats, Travis Baldree (Subter­ranean) June 2024.Unquiet on the Eastern Front, Wole Talabi (Subterranean) October 2024. Flash Fiction Online 11/24 Subterranean Press has recently been of­fering short fiction online for free, and I’m catching up with June’s “Goblins & Greatcoats” byTravis Baldree, which follows Zyll, a goblin escaping the rain and road at a small inn which just happens to be at...Read More We are so happy to release our fifth episode of The Storytellers, our series of Zoom-recorded author readings! Previously, we had Daniel Abraham read ‘The Wind’. Today we are pleased to show Henry Lien reading from the first chapter ofPeasprout Chen: Future Legend of Skate and Sword, the first in his middle grade series revolving around a sport of his own invention combining kung fu and figure skating:...Read More Welcome back for another exciting new books video to kick off the month of March! Come by and learn about our picks for the top new SF, Fantasy, Horror, and YA releases for the week! Stay up-to-date, and support what we do, by subscribing to the YouTube channel! We hope to see you next week for another week of books you’ll be adding to your growing TBR list! Little, Brown Books for Young Readers has announced the launch of New Adult imprint Requited. The slate of initial projects includes fantasy and romantasy titles by Jordan Stephanie Gray, and its staff includes personnel experienced in genre fiction and fantasy. Senior editors are Alice Jerman, previously at Entangled, and Ruqayyah Daud. Lisa Yoskowitz, LBYR’s Executive Editorial Director, will serve as editorial lead. Megan Tingley, president and publisher at LBYR, told...Read More The REH Foundation has announced the shortlist for the 2025 Robert E. Howard Awards, honoring work that is “substantively devoted to the life and/or work of Robert E. Howard” or that “carries on the spirit and tradition of Robert E. Howard, to better recognize and celebrate his influence on future generations of writers.” Members of the REH Foundation vote on the awards. Voting closes on March 15, 2025. The Atlantean—Outstanding HarperCollins Children’s Books has announced the launch of Storytide, a new imprint for middle grade and YA books. Storytide’s slate will include fantasy titlesThat Devil, Ambitionby Linsey Miller andI Killed the Kingby Andrea Hannah and Rebecca Mix. VP and publisher Tara Weikum will lead the imprint. The team will also include Amy Cloud and Kristin Rens as executive editors, and Sarah Homer as editor. On the...Read More The Science Fiction and Fantasy Writers Association (SFWA) has announced C.J. Lavigne as the winner of the 2025 Kevin O’Donnell, Jr. Service to SFWA Award. The award is presented to “a volunteer of SFWA who best exemplifies the ideal of service to the Science Fiction and Fantasy Writers of America.” The announcement notes, among other things, that Lavigne contributed to SFWA’s “flight crew,” or tech support team. SFWA President Kate...Read More Salem’s Lotis the latest entry to the already extensive set of remakes, revisitations, spin-offs, and so on that are based on decades-old Stephen King stories. The list of these kinds of titles is substantial, and it includes 2017 filmItwith 2019 filmIt Chapter Twofollowed by upcoming prequelIt: Welcome to Derry; 2019 filmPet Semataryand 2023 filmPet Sematary: Bloodlines; the admittedly very...Read More Ian Neil McDonald was born March 31, 1960 in Manchester England. He moved to Northern Ireland at age five and has lived there ever since. He attended Bangor Grammar School and worked as head of development for a TV production company. McDonald began publishing SF with ‘‘The Island of the Dead’’ (1982), and his stories soon began to appear regularly in Asimov’s, Interzone, and other magazines. His novels include Locus Locus Magazine and Website cover science fiction, fantasy, young-adult, horror books, short fiction, anthologies, magazines, films, news, conventions, and international. Also interviews with SFF authors, editors, artists, and more."
Mystery & Thriller,CrimeReads,2025-03-09,https://www.crimereads.com,"Ellen Raskin's estate contains not one but two previously unpublished mystery treasures At a farmhouse in Nova Scotia, a seemingly supernatural phenomenon sparked reports and debates around the world. ""How can someone, or something, be stopped by authorities if their existence breaks the laws of physics?"" Masthead About Advertisers: Contact Us Privacy Policy"
